{
  "schema_version": "dime-product-route-observability-benchmark-v1",
  "benchmark_version": "product-route-observability-v1.0.0",
  "control_plane_revision": "dime-composite-engineering-control-v1",
  "data_classification": "synthetic",
  "provenance": {
    "created_at": "2026-07-29T00:00:00Z",
    "source": "reviewed_synthetic_contract_cases",
    "contains_production_data": false
  },
  "cases": [
    {
      "case_id": "product_route_platform_001",
      "prompt": "What can Dime Chat help me with?",
      "legacy_mode": "platform",
      "expected_route": "platform",
      "accepted_alternate_routes": [],
      "entities": [],
      "temporal_state": "not_applicable",
      "tools_required": [],
      "authoritative_sources": ["dime_platform_documentation"],
      "expected_output_schema": "platform_answer_v1",
      "critical_failure_conditions": ["sports_retrieval_invoked"]
    },
    {
      "case_id": "product_route_platform_002",
      "prompt": "Where does Dime show Yankees matchup analysis?",
      "legacy_mode": "platform",
      "expected_route": "platform",
      "accepted_alternate_routes": [],
      "entities": ["New York Yankees"],
      "temporal_state": "not_applicable",
      "tools_required": [],
      "authoritative_sources": ["dime_platform_documentation"],
      "expected_output_schema": "platform_answer_v1",
      "critical_failure_conditions": ["team_name_forces_game_retrieval"]
    },
    {
      "case_id": "product_route_matchup_001",
      "prompt": "Break down Yankees versus Red Sox on July 30.",
      "legacy_mode": "matchup",
      "expected_route": "matchup",
      "accepted_alternate_routes": [],
      "entities": ["New York Yankees", "Boston Red Sox"],
      "temporal_state": "explicit_date",
      "tools_required": ["read_game_context"],
      "authoritative_sources": ["dime_platform_database"],
      "expected_output_schema": "matchup_analysis_v1",
      "critical_failure_conditions": [
        "wrong_event_selected",
        "slate_context_supplied"
      ]
    },
    {
      "case_id": "product_route_matchup_002",
      "prompt": "Analyze Dodgers vs Padres.",
      "legacy_mode": "matchup",
      "expected_route": "matchup",
      "accepted_alternate_routes": [],
      "entities": ["Los Angeles Dodgers", "San Diego Padres"],
      "temporal_state": "missing_date",
      "tools_required": ["read_game_context"],
      "authoritative_sources": ["dime_platform_database"],
      "expected_output_schema": "event_resolution_v1",
      "critical_failure_conditions": ["missing_date_silently_assumed"]
    },
    {
      "case_id": "product_route_full_slate_001",
      "prompt": "Rank tonight's full MLB slate.",
      "legacy_mode": "slate",
      "expected_route": "full_slate",
      "accepted_alternate_routes": [],
      "entities": ["MLB"],
      "temporal_state": "current",
      "tools_required": ["read_game_context"],
      "authoritative_sources": ["dime_platform_database"],
      "expected_output_schema": "slate_analysis_v1",
      "critical_failure_conditions": ["retrieval_cap_exceeded"]
    },
    {
      "case_id": "product_route_full_slate_002",
      "prompt": "Give me the best games on the NBA board for August 1.",
      "legacy_mode": "slate",
      "expected_route": "full_slate",
      "accepted_alternate_routes": [],
      "entities": ["NBA"],
      "temporal_state": "explicit_date",
      "tools_required": ["read_game_context"],
      "authoritative_sources": ["dime_platform_database"],
      "expected_output_schema": "slate_analysis_v1",
      "critical_failure_conditions": ["single_matchup_context_only"]
    },
    {
      "case_id": "product_route_educational_001",
      "prompt": "Calculate the implied probability of +150.",
      "legacy_mode": "educational",
      "expected_route": "educational",
      "accepted_alternate_routes": [],
      "entities": [],
      "temporal_state": "not_applicable",
      "tools_required": ["deterministic_market_math"],
      "authoritative_sources": ["dime_math_contract"],
      "expected_output_schema": "educational_math_v1",
      "critical_failure_conditions": ["model_used_for_deterministic_math"]
    },
    {
      "case_id": "product_route_educational_002",
      "prompt": "What is expected value in sports betting?",
      "legacy_mode": "educational",
      "expected_route": "educational",
      "accepted_alternate_routes": [],
      "entities": [],
      "temporal_state": "not_applicable",
      "tools_required": [],
      "authoritative_sources": ["dime_educational_contract"],
      "expected_output_schema": "educational_answer_v1",
      "critical_failure_conditions": ["unsupported_current_market_claim"]
    },
    {
      "case_id": "product_route_bet_explanation_001",
      "prompt": "Explain this bet: Lakers -4.5 at -110.",
      "legacy_mode": "educational",
      "expected_route": "bet_explanation",
      "accepted_alternate_routes": [],
      "entities": ["Los Angeles Lakers"],
      "temporal_state": "not_applicable",
      "tools_required": ["deterministic_market_math"],
      "authoritative_sources": ["user_supplied_bet"],
      "expected_output_schema": "bet_explanation_v1",
      "critical_failure_conditions": [
        "user_line_presented_as_live_platform_line"
      ]
    },
    {
      "case_id": "product_route_bet_explanation_002",
      "prompt": "How does a same game parlay bet work?",
      "legacy_mode": "educational",
      "expected_route": "bet_explanation",
      "accepted_alternate_routes": [],
      "entities": [],
      "temporal_state": "not_applicable",
      "tools_required": [],
      "authoritative_sources": ["dime_educational_contract"],
      "expected_output_schema": "bet_explanation_v1",
      "critical_failure_conditions": ["fabricated_parlay_price"]
    },
    {
      "case_id": "product_route_historical_001",
      "prompt": "Show the Yankees closing line yesterday.",
      "legacy_mode": "matchup",
      "expected_route": "historical",
      "accepted_alternate_routes": [],
      "entities": ["New York Yankees"],
      "temporal_state": "historical",
      "tools_required": ["read_odds_history"],
      "authoritative_sources": ["historical_odds_provider"],
      "expected_output_schema": "historical_market_v1",
      "critical_failure_conditions": ["current_line_substituted_for_close"]
    },
    {
      "case_id": "product_route_historical_002",
      "prompt": "What happened in the Dodgers past game against the Giants?",
      "legacy_mode": "matchup",
      "expected_route": "historical",
      "accepted_alternate_routes": [],
      "entities": ["Los Angeles Dodgers", "San Francisco Giants"],
      "temporal_state": "ambiguous",
      "tools_required": ["read_historical_results"],
      "authoritative_sources": ["historical_results_provider"],
      "expected_output_schema": "historical_event_resolution_v1",
      "critical_failure_conditions": ["ambiguous_game_silently_selected"]
    },
    {
      "case_id": "product_route_account_001",
      "prompt": "Update my payment method.",
      "legacy_mode": "platform",
      "expected_route": "account",
      "accepted_alternate_routes": [],
      "entities": [],
      "temporal_state": "not_applicable",
      "tools_required": ["read_own_account"],
      "authoritative_sources": ["authenticated_account_store"],
      "expected_output_schema": "account_help_v1",
      "critical_failure_conditions": ["cross_account_data_access"]
    },
    {
      "case_id": "product_route_account_002",
      "prompt": "I cannot log in with my email address.",
      "legacy_mode": "platform",
      "expected_route": "account",
      "accepted_alternate_routes": [],
      "entities": [],
      "temporal_state": "not_applicable",
      "tools_required": [],
      "authoritative_sources": ["dime_account_documentation"],
      "expected_output_schema": "account_help_v1",
      "critical_failure_conditions": ["raw_email_address_traced"]
    },
    {
      "case_id": "product_route_live_data_001",
      "prompt": "What are the live odds for Yankees vs Red Sox right now?",
      "legacy_mode": "matchup",
      "expected_route": "live_data",
      "accepted_alternate_routes": [],
      "entities": ["New York Yankees", "Boston Red Sox"],
      "temporal_state": "current",
      "tools_required": ["read_current_odds"],
      "authoritative_sources": ["authoritative_live_odds_provider"],
      "expected_output_schema": "live_market_v1",
      "critical_failure_conditions": ["stale_odds_presented_as_live"]
    },
    {
      "case_id": "product_route_live_data_002",
      "prompt": "Is the Dodgers starting lineup confirmed?",
      "legacy_mode": "matchup",
      "expected_route": "live_data",
      "accepted_alternate_routes": [],
      "entities": ["Los Angeles Dodgers"],
      "temporal_state": "current",
      "tools_required": ["read_current_lineups"],
      "authoritative_sources": ["authoritative_lineup_provider"],
      "expected_output_schema": "live_lineup_v1",
      "critical_failure_conditions": ["projected_lineup_presented_as_confirmed"]
    },
    {
      "case_id": "product_route_general_sports_001",
      "prompt": "Who is the greatest center in basketball history?",
      "legacy_mode": "educational",
      "expected_route": "general_sports",
      "accepted_alternate_routes": [],
      "entities": ["basketball"],
      "temporal_state": "historical",
      "tools_required": [],
      "authoritative_sources": ["general_sports_knowledge"],
      "expected_output_schema": "general_sports_answer_v1",
      "critical_failure_conditions": ["betting_recommendation_added"]
    },
    {
      "case_id": "product_route_general_sports_002",
      "prompt": "Why do hockey teams pull the goalie?",
      "legacy_mode": "educational",
      "expected_route": "general_sports",
      "accepted_alternate_routes": [],
      "entities": ["hockey"],
      "temporal_state": "not_applicable",
      "tools_required": [],